[
  {
    "wire": "systolic_in1",
    "producers": [
      "fifo"
    ],
    "consumers": [
      "systolic_reg"
    ],
    "width": 32,
    "clock_domain": "i_clk",
    "protocol": "combinational",
    "timing_constraint": "same-cycle (i_clk)"
  },
  {
    "wire": "systolic_in2",
    "producers": [
      "fifo"
    ],
    "consumers": [
      "systolic_reg"
    ],
    "width": 32,
    "clock_domain": "i_clk",
    "protocol": "combinational",
    "timing_constraint": "same-cycle (i_clk)"
  },
  {
    "wire": "fifo_en",
    "producers": [
      "tpu_top"
    ],
    "consumers": [
      "fifo"
    ],
    "width": 1,
    "clock_domain": "i_clk",
    "protocol": "combinational",
    "timing_constraint": "same-cycle (i_clk)"
  },
  {
    "wire": "mac00_in",
    "producers": [
      "systolic_reg"
    ],
    "consumers": [
      "mac"
    ],
    "width": 32,
    "clock_domain": "i_clk",
    "protocol": "registered",
    "timing_constraint": "i_clk"
  },
  {
    "wire": "mac10_in",
    "producers": [
      "systolic_reg"
    ],
    "consumers": [
      "mac"
    ],
    "width": 32,
    "clock_domain": "i_clk",
    "protocol": "registered",
    "timing_constraint": "i_clk"
  },
  {
    "wire": "mac01_in",
    "producers": [
      "mac"
    ],
    "consumers": [
      "mac"
    ],
    "width": 32,
    "clock_domain": "i_clk",
    "protocol": "registered",
    "timing_constraint": "i_clk"
  },
  {
    "wire": "mac11_in",
    "producers": [
      "mac"
    ],
    "consumers": [
      "mac"
    ],
    "width": 32,
    "clock_domain": "i_clk",
    "protocol": "registered",
    "timing_constraint": "i_clk"
  },
  {
    "wire": "mem[0]",
    "producers": [
      "tpu_top"
    ],
    "consumers": [
      "mac"
    ],
    "width": 32,
    "clock_domain": "i_clk",
    "protocol": "registered",
    "timing_constraint": "i_clk"
  },
  {
    "wire": "mem[1]",
    "producers": [
      "tpu_top"
    ],
    "consumers": [
      "mac"
    ],
    "width": 32,
    "clock_domain": "i_clk",
    "protocol": "registered",
    "timing_constraint": "i_clk"
  },
  {
    "wire": "mem[2]",
    "producers": [
      "tpu_top"
    ],
    "consumers": [
      "mac"
    ],
    "width": 32,
    "clock_domain": "i_clk",
    "protocol": "registered",
    "timing_constraint": "i_clk"
  },
  {
    "wire": "mem[3]",
    "producers": [
      "tpu_top"
    ],
    "consumers": [
      "mac"
    ],
    "width": 32,
    "clock_domain": "i_clk",
    "protocol": "registered",
    "timing_constraint": "i_clk"
  },
  {
    "wire": "32'h0",
    "producers": [
      "const"
    ],
    "consumers": [
      "mac"
    ],
    "width": 32,
    "clock_domain": "i_clk",
    "protocol": "const",
    "timing_constraint": "static"
  },
  {
    "wire": "mac00_out",
    "producers": [
      "mac"
    ],
    "consumers": [
      "mac"
    ],
    "width": 32,
    "clock_domain": "i_clk",
    "protocol": "registered",
    "timing_constraint": "i_clk"
  },
  {
    "wire": "mac01_out",
    "producers": [
      "mac"
    ],
    "consumers": [
      "mac"
    ],
    "width": 32,
    "clock_domain": "i_clk",
    "protocol": "registered",
    "timing_constraint": "i_clk"
  },
  {
    "wire": "out1",
    "producers": [
      "mac"
    ],
    "consumers": [
      "tpu_top"
    ],
    "width": 32,
    "clock_domain": "i_clk",
    "protocol": "registered",
    "timing_constraint": "i_clk"
  },
  {
    "wire": "out2",
    "producers": [
      "mac"
    ],
    "consumers": [
      "tpu_top"
    ],
    "width": 32,
    "clock_domain": "i_clk",
    "protocol": "registered",
    "timing_constraint": "i_clk"
  },
  {
    "wire": "result_fifo_i_data",
    "producers": [
      "tpu_top"
    ],
    "consumers": [
      "fifo"
    ],
    "width": 32,
    "clock_domain": "i_clk",
    "protocol": "combinational",
    "timing_constraint": "same-cycle (i_clk)"
  },
  {
    "wire": "result_fifo_o_data",
    "producers": [
      "fifo"
    ],
    "consumers": [
      "tpu_top"
    ],
    "width": 32,
    "clock_domain": "i_clk",
    "protocol": "combinational",
    "timing_constraint": "same-cycle (i_clk)"
  }
]
